headline,summary,author,time,day,category
Adani Green's unit appeals against tax demand,"Adani Green Energy's subsidiary Adani Energy has filed an appeal before the Commissioner of Income Tax (Appeals). The matter is related to the computation of capital gains on account of the transfer of equity shares in an internal restructuring scheme, a filing said. The expected financial implication, if any, due to compensation or penalty could be ₹72.16 crore, it added.",Mansi Agarwal, 05:27 pm,"Tuesday, 15 August, 2023",business
EX-WSJ reporter ends Indian hacker lawsuit against Dechert,"Former Wall Street Journal reporter Jay Solomon ended his lawsuit against Dechert and two of its former partners. Solomon had sued Dechert and others last year, alleging that the firm worked with hackers from India to steal emails between him and one of his sources. Solomon alleged the messages were later circulated in a successful effort to get him fired.
",Srishty Choudhury, 04:37 pm,"Tuesday, 15 August, 2023",business
Fitch warns it may be forced to downgrade several US banks: Report,"A Fitch Ratings' analyst warned that US banks, including JPMorgan Chase, could be downgraded if the agency further cuts its assessment of the industry's operating environment, according to a report from CNBC. In June, Fitch lowered the score of the US banking industry's ""operating environment"" to AA- from AA, citing pressure on the country's credit rating, gaps in regulatory framework.",Srishty Choudhury, 04:28 pm,"Tuesday, 15 August, 2023",business
"Govt hikes windfall tax on crude petroleum to ₹7,100 per tonne","The government has hiked the windfall tax on domestically produced crude petroleum from ₹4,250 per tonne to ₹7,100 per tonne. Apart from crude oil, the special additional excise duty (SAED) on the export of diesel has also been hiked from ₹1 per litre to ₹5.50 per litre. A duty of ₹2 per litre has also been imposed on jet fuel.",Mansi Agarwal, 04:22 pm,"Tuesday, 15 August, 2023",business
"VIP Industries MD Anindya Dutta resigns, CFO to replace him","VIP Industries on Tuesday announced that MD Anindya Dutta has resigned from his position due to personal reasons. In a regulatory filing, the company said Executive Director and Chief Financial Officer Neetu Kashiramka will succeed Dutta. Kashiramka will take over as the MD and CFO of the company with effect from November 14.",Mansi Agarwal, 03:54 pm,"Tuesday, 15 August, 2023",business
China stops releasing youth joblessness data amid economic slump,"China suspended the publication of data on youth joblessness figures on Tuesday after the figure hit consecutive record highs in recent months amid a broader economic slump. The Chinese government said the move was necessary as current statistics ""need to be improved"". The National Bureau of Statistics of China said the government is reconsidering the method of calculating unemployment.",Disha Jana, 03:19 pm,"Tuesday, 15 August, 2023",business
India's imports from Russia doubled to $20.45 bn in April-July,"India's imports from Russia doubled to ₹20.45 billion during the April-July period of FY24 due to increasing inbound shipments of crude oil and fertiliser from that country, Commerce Ministry data showed. With this, Russia has become India's second-largest import source during the first four months of FY24. Russia's share of India's oil imports rose to over 40% since Russia-Ukraine conflict.",Srishty Choudhury, 02:48 pm,"Tuesday, 15 August, 2023",business
Cybersecurity firm Secureworks to lay off 15% of its workforce,"Secureworks said it will lay off 15% of its workforce. The cybersecurity firm said it would incur about $14.2 million in expenses due to the layoffs, mostly related to employee termination benefits and real-estate costs. This would be Secureworks' second round of layoffs after 9% workforce reduction in February. Secureworks said the departing employees' last day will be August 25.
",Srishty Choudhury, 02:13 pm,"Tuesday, 15 August, 2023",business
UK basic wage growth hits record high of 7.8%,"Basic wages in UK hit a new record growth rate of 7.8% fuelling forecasts that the Bank of England will be forced to raise interest rates again to calm inflation. Official data showed some fresh signs of cooling in the jobs market with the unemployment rate rising to 4.2% from 4%, the highest since the three months to October 2021.",Srishty Choudhury, 01:57 pm,"Tuesday, 15 August, 2023",business
Nigeria inflation rises to 18-year high,"Nigeria's annual inflation rose to its highest level in 18 years in July at 24.08% against 22.79% in June. Food inflation rose to 26.98% in July from 25.25% in June. Nigeria's inflation has been in double digits since 2016, eroding savings and incomes and prompting the central bank to hike interest rates to their highest level in nearly two decades.
",Pragya Swastik, 01:22 pm,"Tuesday, 15 August, 2023",business
List shows record of India's 10 captains in T20I cricket,"Jasprit Bumrah will become 11th cricketer to lead India in T20I cricket during India's series against Ireland which begins on August 18. MS Dhoni has led India in most matches (72), followed by Rohit Sharma (51) and Virat Kohli (50). India won most matches under Dhoni (41). Suresh Raina led India in three T20Is, with India winning all of them.",Anmol Sharma, 05:23 pm,"Tuesday, 15 August, 2023",sports
"Experts, including Ravi Shastri, name their Team India squad for Asia Cup","Experts, including Ravi Shastri, Sandeep Patil and MSK Prasad, have predicted their India squad for Asia Cup 2023. Their 15 include Shubman Gill, Ishan Kishan, Virat Kohli, Rohit Sharma, Tilak Varma, Suryakumar Yadav, Hardik Pandya, Ravindra Jadeja, Axar Patel, Shardul Thakur, Yuzvendra Chahal, Kuldeep Yadav, Mohammad Shami, Mohammed Siraj & Jasprit Bumrah. Asia Cup 2023 will begin on August 30.",Anmol Sharma, 05:23 pm,"Tuesday, 15 August, 2023",sports
"Neymar bought by Al-Hilal for over ₹900 crore, to earn ₹2,500 crore in 2 years","Saudi Arabian club Al-Hilal has bought Brazilian forward from PSG for a fee of over £86 million (more than ₹900 crore). He will earn over £235 million (around ₹2,500 crore) salary in two years with the club. Neymar had joined PSG from Barcelona in 2017. He scored 118 goals for the Parisian club.",Anmol Sharma, 05:20 pm,"Tuesday, 15 August, 2023",sports
No shame in losing to WI but this is a wake-up call: Gavaskar,"Former India captain Sunil Gavaskar said the T20I series loss to West Indies ""should not be a dampener"". ""They have won the...T20 World Cup twice...they are a top-class T20 team, and there's no shame in losing to them,"" said Gavaskar. Adding that this wasn't a ""full strength"" India team, Gavaskar said the loss should act as a ""wake-up call"". ",Aditya Nair, 05:11 pm,"Tuesday, 15 August, 2023",sports
Ronaldo deserves to play for Portugal by just being there: Dzyuba,"Russian footballer Artem Dzyuba said Cristiano Ronaldo deserves to play for Portugal by ""just being there"". Talking about Ronaldo being benched during the Qatar World Cup, Dzyuba stated, ""Against Switzerland, it was like, 'Ah, that's it. Old f**k. Nobody needs you'...The man scored 800 goals...Portugal is associated with Ronaldo for the whole world. And, that's how you treat him!""",Arnab Mukherji , 05:09 pm,"Tuesday, 15 August, 2023",sports
Smriti Irani names MS Dhoni as her favourite cricketer,"Union Minister Smriti Irani termed MS Dhoni as her favourite cricketer, following a question regarding this aspect from a fan on Instagram. She shared three stickers featuring Dhoni to reveal her choice. Irani had earlier wished the former Team India captain on his 38th birthday on Instagram, with the caption in her Instagram Story stating, ""Dhoni, naam hi kaafi hai.""",Arnab Mukherji , 05:00 pm,"Tuesday, 15 August, 2023",sports
"RR pay tribute to MSD, Raina, say 'not every pic needs a caption'","Rajasthan Royals paid tribute to former India captain MS Dhoni and batter Suresh Raina on the third anniversary of their retirement. ""Not every image needs a caption,"" wrote RR on X, sharing a phone wallpaper with the time showing '19:29'. Dhoni and Raina retired from international cricket on August 15, 2020, within a few hours of each other. ",Aditya Nair, 05:00 pm,"Tuesday, 15 August, 2023",sports
Hardik's bowling changes in 5th T20I vs WI looked confused: Mukund,"Ex-India opener Abhinav Mukund said Hardik Pandya looked confused with regard to his bowling changes in fifth T20I against West Indies. ""I would've started with Axar Patel which was the winning formula in...fourth T20I. Axar Patel should've started bowling with the new ball [alongside] Arshdeep Singh,"" he added. West Indies defeated India by eight wickets in the fifth T20I.",Arnab Mukherji , 04:46 pm,"Tuesday, 15 August, 2023",sports
"De Bruyne's injury vs Burnley termed 'serious', out for 3-4 months",Midfielder Kevin De Bruyne could be sidelined for three to four months after suffering a hamstring injury in their season-opening Premier League game. The Belgium international left the field in the 36th minute of City's 3-0 win against Burnley. Manager Pep Guardiola confirmed that De Bruyne suffered a recurrence of the injury he picked up during the Champions League final.,Aditya Nair, 04:42 pm,"Tuesday, 15 August, 2023",sports
Premier League's 1st ever goal came via flying header 31 years ago,"On August 15, 1992, Sheffield United's Brian Deane scored the then-newly-formed Premier League's first-ever goal. Deane scored with a flying header as early as the fifth minute of the season's opening game against Manchester United. Deane scored his second of the match in the 50th minute and Manchester United's Mark Hughes scored in the 61st as Sheffield won 2-1.   ",Aditya Nair, 04:29 pm,"Tuesday, 15 August, 2023",sports
YouTube to remove content promoting 'harmful' cancer treatments,"YouTube on Tuesday said it will remove content that promotes ""harmful or ineffective"" cancer treatments like a video that claims ""garlic cures cancer"". Content that ""discourages viewers from seeking professional medical treatment"" will also be removed, YouTube stated. It further said that videos disputing ""the existence of specific health conditions"" like COVID-19 won't be allowed on the platform.",Mansi Agarwal, 04:45 pm,"Tuesday, 15 August, 2023",technology
Indian Army procures logistic drones for high-altitude areas,"Indian Army has procured logistic drones for high-altitude areas to achieve greater flexibility in operational logistics, maintenance of secluded posts and reducing last-mile delays in delivery. ""We've also acquired Mini RPAS to enhance surveillance capabilities in high altitudes,"" Defence officials said. For capability development, the Design Bureau is also taking a large number of initiatives.
",Srishty Choudhury, 03:55 pm,"Tuesday, 15 August, 2023",technology
Apple warns against sleeping next to iPhones put on charge,"Apple has warned against sleeping next to iPhones as they charge. ""Don't sleep on a device, power adapter, or wireless charger, or place them under a blanket, pillow, or your body, when it's connected to a power source,"" Apple said. ""Keep your iPhone, power adapter, and any wireless charger in a well-ventilated area when in use or charging,"" it added.",Pragya Swastik, 03:16 pm,"Tuesday, 15 August, 2023",technology
Russia fines Reddit for first time over 'banned content': Report,"Russia fined social media site Reddit for the first time for not deleting ""banned content"" that it said contained ""fake"" information about Russia's military campaign in Ukraine, RIA reported citing a Moscow court. The court fined Reddit two million roubles ($20,365). Reddit joins a list of sites under scrutiny in Russia for failing to remove content that Moscow deems illegal.",Srishty Choudhury, 03:09 pm,"Tuesday, 15 August, 2023",technology
"ISRO hand-holding private space firms, startups: Ex-Chairman Sivan","Former ISRO Chairman K Sivan said the space agency is promoting and hand-holding private space companies and startups. ISRO is ""providing all its facilities for the private sector to carry out space activities at a very nominal cost"", Sivan added. He further talked about ISRO's collaboration with NASA on the NISAR mission and said it'll benefit the entire mankind.",Mansi Agarwal, 03:08 pm,"Tuesday, 15 August, 2023",technology
Chandrayaan has lots of potential for humankind in future: K Sivan,"Former ISRO chief K Sivan said the Chandrayaan-3 mission has lots of potential for humankind in the future. These kinds of advanced technologies may not benefit humankind today but they will do a great job later, he stated. He added that people also questioned ISRO's benefits in the 1960s, but today its contribution to the common man is understandable.",Mansi Agarwal, 02:47 pm,"Tuesday, 15 August, 2023",technology
Cybersecurity firm Secureworks to lay off 15% of its workforce,"Secureworks said it will lay off 15% of its workforce. The cybersecurity firm said it would incur about $14.2 million in expenses due to the layoffs, mostly related to employee termination benefits and real-estate costs. This would be Secureworks' second round of layoffs after 9% workforce reduction in February. Secureworks said the departing employees' last day will be August 25.
",Srishty Choudhury, 02:13 pm,"Tuesday, 15 August, 2023",technology
X scales down ad unit generating $100 million revenue: Report,"X (formerly Twitter) has started depreciating an ad unit that allows advertisers to promote their accounts within the platform's timeline to attract new followers, Axios reported. The unit named 'Followers objective' brings X over $100 million in global revenue annually, the report said. Confirming the change, X said it has suggested advertisers to try other types of ad units.",Mansi Agarwal, 01:41 pm,"Tuesday, 15 August, 2023",technology
No proposal to restrict more electronics' imports: Commerce Secy,"There's no proposal at present to impose import restrictions on more electronics goods, Commerce Secretary Sunil Barthwal said. ""We don't want ourselves to be dependent upon very few sources of imports...So what we're doing, we're evaluating the position in consultation with various ministries. We're looking at trends but there's nothing in the offing as of now,"" Barthwal said.",Ashley Paul, 11:45 am,"Tuesday, 15 August, 2023",technology
"Infosys, Liberty Global ink $1.6-bn deal to scale digital platform","Infosys and Liberty Global announced a five-year agreement, with the provision to extend up to eight years and beyond, to transform and expand Liberty Global's digital entertainment and connectivity platforms. The deal is valued at $1.64 billion. The expanded collaboration will create ""exciting career opportunities"" for over 400 Liberty Global employees joining Infosys.
",Srishty Choudhury, 11:31 am,"Tuesday, 15 August, 2023",technology
SRK changes his social media profile pic to National Flag on I-Day,"On India's 77th Independence Day, Shah Rukh Khan changed his profile picture on social media platforms to the picture of India's National Flag. Earlier in the day, the actor had posted a picture, which also featured his wife Gauri Khan and son Abram. On the work front, the actor will be seen in Atlee directorial 'Jawan'.  ",Kameshwari, 05:24 pm,"Tuesday, 15 August, 2023",entertainment
"Lakhs came on Gadar set, things got disorderly: Amrish's grandson","Actor Vardhan Puri said his grandfather Amrish Puri told him how lakhs of people had arrived on 'Gadar' sets in Amritsar. ""Things got disorderly. [He] had taken the mic and got...crowd in control with the help of...PA system. Only after that could they proceed with...shoot,"" he concluded. Vardhan said seeing CGI version of Amrish in 'Gadar 2' was emotional.
",Kameshwari, 05:20 pm,"Tuesday, 15 August, 2023",entertainment
"Rajinikanth helps man who walked for 55 days to meet him, pic surfaces","Actor Rajinikanth is in Uttarakhand for a spiritual trip, where he met a fan who walked for almost 55 days from Chennai to meet him. He also helped him financially. A report said that as he was sleeping under a tree, Rajinikanth helped him move into a small place with a sanyasi.
",Daisy Mowke, 05:11 pm,"Tuesday, 15 August, 2023",entertainment
"Never felt I looked like a heroine, learnt to become one: Divya ","Divya Dutta, in an interview with Hauterrfly, said she never felt that she looked like a heroine and had to ""learn"" how to become one. ""I was busty...I wasn't very tall so I wasn't considered to be one of those stereotypical tall beautiful girls,"" Divya said, adding, ""To fit into the mould was...little difficult...To become like...tall, very thin, pretty girls."" ",Udit Gupta, 04:54 pm,"Tuesday, 15 August, 2023",entertainment
"Sushant's sister shares post on I-Day, shares late actor's pic ","On the occasion of Independence Day on Tuesday, Sushant Singh Rajput's sister Shweta Singh Kirti shared a picture of the late actor and penned a note about India. ""We, as Indians never give up. We shine even when faced with the toughest of situations,"" Shweta wrote, adding, ""We're proud to belong to a nation...where we never lose our values."" ",Udit Gupta, 04:50 pm,"Tuesday, 15 August, 2023",entertainment
Suriya rubbishes rumours of moving to Mumbai  ,"Suriya, who primarily works in Tamil cinema, reacted to rumours that he'll be moving to Mumbai after he bought a ₹70-crore property in the city. ""Nothing like that...My children are studying in Mumbai...I used to go there just to see them...I'm in Chennai,"" he said. On the work front, Suriya will next be seen in 'Irumbu Kai Maayavi' and 'Kanguva'.
 ",Udit Gupta, 04:30 pm,"Tuesday, 15 August, 2023",entertainment
"Paris Hilton seen vacationing in Maui amid wildfires, criticised","Paris Hilton was seen vacationing on the beaches of Maui, Hawaii just a few miles away from where wildfires have claimed nearly 100 lives. She was criticised for continuing the vacation despite officials urging tourists to stay away. ""While Maui burns, Paris Hilton Fiddles (on vacay in Maui)! Get a clue honey and go home,"" a Twitter user said.",Deepika Bhatt, 04:24 pm,"Tuesday, 15 August, 2023",entertainment
Never felt uncomfortable during shooting: OMG 2 child actor Aarush,"'OMG 2' child actor Aarush Varma said the Akshay Kumar-starrer ""could've been even an eye-opener"" for the audience. ""We were so many kids in the film and we never felt uncomfortable shooting the film,"" he shared. Aarush added, ""The...purpose...this film...was to open discussions on the need for Sex Education...unfortunately [it]...has become a subject of discussion with being given A certificate.""",Kameshwari, 04:09 pm,"Tuesday, 15 August, 2023",entertainment
"Abhishek Malhan hospitalised after 'Bigg...' finale, shares video ","'Bigg Boss OTT 2' runner-up Abhishek Malhan was hospitalised after the finale of the show. He shared a video from the hospital on his Instagram handle and apologised to his fans and followers for not winning the trophy. Abhishek also congratulated Elvish Yadav for winning the Salman Khan-hosted show.
 ",Udit Gupta, 03:22 pm,"Tuesday, 15 August, 2023",entertainment
"With 'Holiday', I thought I'll be a superstar overnight: Freddy","Actor Freddy Daruwala said that when 'Holiday' (2014) released, he thought he'd become a superstar overnight. However, he realised that the ""journey itself is long and a never ending"" one. Freddy is currently shooting for his maiden International project 'Aaina'. ""Very few people wake up...do a job they love the most. I am extremely lucky in that sense,"" he added. 
",Kameshwari, 02:44 pm,"Tuesday, 15 August, 2023",entertainment
Oldest woman in India passes away,"Kunjannam, a 112-yr-old woman from Parannur (Kerala), who was declared the oldest living woman in India by Limca Book of Records, passed away Tuesday morning. She had been unwell for some days and had been unable to eat anything since Monday. In an interview, Kunjannam had revealed that vegetarian food and regular walks were what kept her healthy.",Shipra Sharma, 09:03 am,"Tuesday, 24 March, 2015",india
Infosys Gifts Sikka Shares Worth Rs 8.2cr,"In a regulatory filing to the BSE on Friday, Infosys Ltd. decided to give shares worth Rs. 8.2cr to its new CEO Vishal Sikka. &quot;The units will vest with Sikka for over 4 years subject to his continued employment&quot; the company said. The 47-yr-old is a former member of the Executive Board of SAP AG.",Tanya Mathur, 05:25 pm,"Sunday, 24 August, 2014",india
India's first Billiards Premier League,"The Billiards and Snooker Association of Maharashtra(BSAM) has decided to inaugurate the Videocon Billiards Premier League in Mumbai from August 16 to 24, at 6 clubs of South Mumbai. Ten teams will participate in the league.&ldquo;This is a sincere attempt to revive billiards which has been overshadowed by snooker and other cue sports..&rdquo; explained Derek Sippy, BSAM honorary joint secretary",Sumedha Sehra, 02:30 pm,"Tuesday, 5 August, 2014",india
India beat NZ 3-2 to enter CWG hockey finals,"In the CWG men's hockey semi-final against New Zealand on Saturday, India got a 3-2 victory, securing their place in the finals. The team rose from a 2-0 score to a 3-2 score, and will now been seen playing the finals against Australia on Sunday. Interestingly, in the last CWG in Delhi, the same teams met in the finals. ",Sumedha Sehra, 06:43 pm,"Saturday, 2 August, 2014",india
"Indian Navy gets VLF, easy communication with underwater submarines","The Indian navy has a new communication system critical for passing coded orders to nuclear submarines, commissioned at INS Kattabomman(Tirunelveli, Tamil Nadu). &quot;The new facility will boost our ability to communicate with submarines, which have trailing wire antenna to pick up the coded VLF (very low frequency) radio waves, on an uninterrupted basis throughout the year,&quot; said an officer. ",Sumedha Sehra, 07:43 pm,"Friday, 1 August, 2014",india
Bharti Airtel rakes in 61% profit,"Bharti Airtel, India's top telecommunications company has reported a 61 percent quarterly profit rise. Compared to last year's 6.89 billion, the company has reportedly made a profit of 11.08 billion rupees ($184.31 million), though analysts were expecting a profit of 12.17 billion rupees for the company. ",Sumedha Sehra, 01:23 pm,"Tuesday, 29 July, 2014",india
"Samsung launches Galaxy Star 2 Plus at Rs.7,335","Samsung has unveiled the Galaxy start 2 Plus smartphone in India, at a price of Rs. 7,335. The budget phone, launched to compete against Moto E, Micromax Unite 2 and their likes, is an Android 4.4 (KitKat) handset. With a 4.3-inch screen, 1.2GHz processor, 512MB RAM and Samsung's TouchWiz skin on top, it is to be available for sale, soon. ",Sumedha Sehra, 01:22 pm,"Tuesday, 29 July, 2014",india
"Nigerian weightlifter in dope net, India may gain","India may move up after Nigerian weightlifter Chika Amalaha&rsquo;s A dope sample returned positive. Santoshi Matsa&rsquo;s bronze and Swati Singh's 4th position may be upgraded in women&rsquo;s 53kg. &ldquo;We shouldn&rsquo;t presume anything just yet, once she has provided a B sample that is when we can decide on the re&mdash;awarding of medals and appropriate actions&quot; said CWG-Federation chief-executive Mike Hooper.",Sumedha Sehra, 01:17 pm,"Tuesday, 29 July, 2014",india
Assam govt aims to completely withdraw AFSPA by year end: CM,"On Independence Day, Assam CM Himanta Biswa Sarma said, ""Our government's aim is to completely withdraw the Armed Forces Special Powers Act (AFSPA) from the state by the end of this year."" ""Before our government came to power, previous governments had requested the Centre to extend AFSPA 62 times. Now, the situation has been improving,"" CM Sarma added.",Saurabh Sinha, 03:43 pm,"Tuesday, 15 August, 2023",politics
Those who talk about 'Hindu Rashtra' should resign: Digvijaya,Congress leader Digvijaya Singh said that any person who has taken the oath of the Constitution and still talks about 'Hindu Rashtra' should resign from his post. Singh also said that there is no such thing as 'Soft Hindutva' or 'Hard Hindutva'. He added that VD Savarkar himself said that 'Hindutva' has nothing to do with Hinduism or 'Sanatan Dharma'.,Saurabh Sinha, 03:24 pm,"Tuesday, 15 August, 2023",politics
Urge govt to give people peace and stress-free life: Mayawati,"Wishing people on Independence Day, BSP chief Mayawati said it is important for the government to give people ""peace, harmony and a stress-free and comfortable life"". ""[India] remains cursed by immense poverty, unemployment, backwardness, huge income gap between rich and poor and devaluation of rupee etc. Salvation of people from such a cursed life is very important now,"" she added.",Saurabh Sinha, 12:52 pm,"Tuesday, 15 August, 2023",politics
PM Modi's I-Day speech was like a farewell speech: AAP's Bharadwaj,"AAP leader Saurabh Bharadwaj on Tuesday said that PM Narendra Modi's Independence Day speech was like a ""farewell speech"". ""I think this is the last speech of the PM on the Red Fort. After this, the PM will definitely come to the Red Fort, but will sit on the front chairs and listen to some other PM,"" he added.",Saurabh Sinha, 12:07 pm,"Tuesday, 15 August, 2023",politics
Maybe Kharge will show up for the Italian I-Day: IT Minister,"Reacting to Congress chief Mallikarjun Kharge's absence during the PM's Independence Day address at Red Fort, Union Minister of Electronics and IT Rajeev Chandrasekhar said, ""Maybe he'll show up for the Italian Independence Day."" He said that Kharge must have got direction from the Gandhi family to not attend the ceremony.",Saurabh Sinha, 11:46 am,"Tuesday, 15 August, 2023",politics
