headline,summary,author,time,day,category
Which are the world's most powerful passports?,"Singapore's passport is the world's most powerful with visa-free access to 192 travel destinations, Henley Passport Index showed. Germany, Italy and Spain's passports rank 2nd. Austria, Finland, France, Japan, Luxembourg, South Korea, and Sweden, all rank 3rd. Denmark, Ireland, Netherlands and UK rank 4th. Belgium, Czech Republic, Malta, NZ, Norway, Portugal and Switzerland's passports rank 5th.",Pragya Swastik, 01:15 pm,"Tuesday, 18 July, 2023",travel
"Singapore passport named world's most powerful, beats Japan","Singapore is the world's most powerful passport with visa-free access to 192 travel destinations out of 227 around the world, according to Henley Passport Index released on Tuesday. Germany, Italy, and Spain all move up into second place. Japan has been knocked off the top spot for the first time in five years and bumped into third place.",Pragya Swastik, 12:15 pm,"Tuesday, 18 July, 2023",travel
MakeMyTrip launches Rocky & Rani-inspired romantic holiday packages,"Bollywood stars Ranveer Singh and Alia Bhatt in their new avatar Rocky & Rani have co-created exclusive holiday packages with MakeMyTrip. The marquee package is inspired by the song ""Tum Kya Mile"" from their upcoming film ""Rocky Aur Rani Ki Prem Kahani"" and covers picturesque locations featured in the song. Travelers can explore other exclusive packages on MMT app/website.",Roshan Gupta, 06:02 am,"Thursday, 13 July, 2023",travel
Indians lose ₹87 crore to Schengen visa rejections in 2022: Report,"Schengen visa applicants from India lost ₹87 crore to visa rejections in 2022, according to data from Schengen Visa Info. A total of 6,71,928 applications were filed at consulates and visa centres in India, out of which 1,21,188 applications were rejected. India had the second-highest Schengen visa rejections in the world last year. ",Pragya Swastik, 01:15 pm,"Tuesday, 11 July, 2023",travel
Japan Airlines to offer clothes on rent to its Japan-bound passengers,"Japan Airlines will start an initiative where it will offer rental clothing to passengers during their visit to the island nation. Aimed at reducing luggage and promoting sustainable tourism, the airline said visitors will get the option to select the clothes via a website before their travel. The clothes, starting from $28, will be delivered to the traveller's hotel.",Ridham Gambhir, 08:59 am,"Wednesday, 5 July, 2023",travel
Thailand's Koh Samui facing water crisis amid tourism surge ,"One of Thailand’s popular islands, Koh Samui, is facing a severe water crisis caused by a surge of tourists and decline in rainfall. According to local estimates, the remaining water is sufficient only for the next 30 days. Famous for its beaches, trekking destinations and jungle safari, Koh Samui hosts some 27,00,000 visitors per year.",Ridham Gambhir, 03:41 am,"Wednesday, 5 July, 2023",travel
Which were the most & least delayed Indian airlines in May 2023?,"SpiceJet was the most delayed airline in May 2023, as per DGCA, with 61% of its flights departing on time. Air India was the second-most delayed in May (82.5% of flights were punctual), followed by Air Asia (84.8%) and Vistara (89.5%). IndiGo and Akasa Air were the most punctual airlines with 90.3% and 92.6% of their flights leaving on time. ",Sakshita Khosla, 10:39 am,"Tuesday, 4 July, 2023",travel
Astronaut shares pic of Delhi from space while wishing India on Independence Day,"Emirati astronaut Sultan AlNeyadi on Tuesday shared a photo of Delhi from space as he wished India on its 77th Independence Day. He greeted people with 'Namaste' in 11 Indian languages. ""To all Indians around the world, Happy Independence Day from...International Space Station! Sharing with you a capture of India's capital, New Delhi, from space,"" he wrote on Twitter. ",Daisy Mowke, 04:13 pm,"Tuesday, 15 August, 2023",miscellaneous
"2-yr-old accidentally pierces eye & brain with scissors in Bengal, saved by surgery","A 2-year-old boy who accidentally pierced his eye and brain while playing with scissors in West Bengal's Howrah, was saved after a two-and-half-hour surgery at Kolkata's IPGMER. A CT scan of the boy was done, which revealed that the scissors pierced his brain, causing massive bleeding. The boy's skull was opened up to remove the scissors, doctors said.",Sakshita Khosla, 04:12 pm,"Tuesday, 15 August, 2023",miscellaneous
"Restaurant charges family ₹1,800 for slicing cake in Italy","A family in Italy was charged 20 euros (around ₹1,800) for cutting a cake they had brought with themselves into 20 pieces. The family was charged for slicing their cake despite them ordering food and beverages worth 121 euros from the restaurant. Earlier, a tourist in Italy was charged ₹180 by a restaurant for cutting a sandwich in half.",Pragya Swastik, 02:16 pm,"Tuesday, 15 August, 2023",miscellaneous
"13-year-old boy slips & falls 100 ft from cliff at US' Grand Canyon, survives","A 13-year-old boy named Wyatt Kauffman slipped and fell 100 feet from a cliff at the Grand Canyon in the US, and survived the fall. He was airlifted to a hospital after suffering a ruptured spleen, collapsed lung, nine broken vertebrae, a concussion, etc. He fell while trying to move out of the way of some people taking a picture.",Sakshita Khosla, 11:11 am,"Monday, 14 August, 2023",miscellaneous
"Plane drops 15,000 feet in 3 minutes in US, passenger shares pics","A passenger of an American Airlines plane headed to US' Florida shared pictures from inside the aircraft after it reportedly dropped 15,000 feet in three minutes. ""Something failed mid-flight and depressurised the cabin,"" said the passenger named Harrison Hove, describing the incident as ""terrifying"". His pictures showed the flight's emergency oxygen masks hanging from the overhead.",Sakshita Khosla, 03:18 pm,"Sunday, 13 August, 2023",miscellaneous
IFS officer shares pic of one of world’s largest squirrel species found in India,"IFS officer Parveen Kaswan took to social media to share a picture of one of the world's largest squirrel species found in India. Stating that the picture was taken in West Bengal's Buxa, the officer asked, ""Can you identify?"" Responding to his post, several people commented it is Malabar giant squirrel while some said it's Malayan giant squirrel.",Arshiya Chopra, 06:23 am,"Sunday, 13 August, 2023",miscellaneous
Sandstorm turns skies above Morocco's Marrakesh orange; video out,"Orange-coloured skies covered the city as a sandstorm hit Morocco's Marrakesh on Thursday. A video showing the streets covered in an eerie orange hue was shared by The Independent. The storm, however, caused destruction, resulting in the death of an 18-year-old man by a fallen tree in the city's Medina quarter, as per local media.",Swati Dubey, 03:20 pm,"Saturday, 12 August, 2023",miscellaneous
"Wild bear spotted running in residential area in Telangana, people panic; video surfaces","A video surfaced online showing a wild bear straying into a residential area in Telangana's Karimnagar district, with people in the area panicking. In the video, it can be seen running on a road near people and shops. As per reports, the bear was sighted in two different areas on Friday night and Saturday morning.",Anmol Sharma, 01:34 pm,"Saturday, 12 August, 2023",miscellaneous
17 sets of twins to start school in Scotland; pic goes viral,"Seventeen sets of twins will start primary school in Scotland's Inverclyde on August 18, with a picture going viral. It is the second highest twin count for Inverclyde following a record 19 sets in 2015. The class of 2023 will take the Inverclyde twin count to 147 sets since 2013, which is an average of 13 sets each year.",Ankush Verma, 12:00 pm,"Saturday, 12 August, 2023",miscellaneous
Watch a father’s awakening: Manyavar presents new Independence Day film,"Manyavar presents an ode to Independence in its new ad, seeking to showcase an undying spirit, and a journey echoing through generations. Sometimes the young ones teach us the biggest of the lessons, it said. The ad shows a spirited boy who reminds his dad of the 100 years of struggle with a powerful message in the end.",Roshan Gupta, 06:50 am,"Saturday, 12 August, 2023",fashion
"Beyoncé wears crystal bodysuit by Indian designer Gaurav Gupta on stage, pics viral","Singer Beyoncé wore a custom crystal bodysuit and legging boots by Indian designer Gaurav Gupta while performing on stage during her Renaissance World Tour Concert. ""We custom made the Infinity Crystal Bodysuit...inspired by the new logo of Gaurav Gupta Couture,"" a post on Gaurav Gupta's Instagram page read. He further called Beyoncé an ""epitome of hope, infinity, and freedom"".",Daisy Mowke, 11:01 am,"Friday, 11 August, 2023",fashion
Coach owner to buy Michael Kors parent for $8.5 billion: Report,"Coach parent Tapestry will buy Michael Kors owner Capri Holdings for $8.5 billion, creating a top US fashion house, The Wall Street Journal reported. Tapestry will pay Capri shareholders $57 per share in cash, representing a premium of nearly 65%. Capri's shares were trading at $54.90 before the bell on Thursday. Tapestry's shares were down 2%.",Srishty Choudhury, 12:41 pm,"Thursday, 10 August, 2023",fashion
UK fashion brand Superdry gets $32 mn funding for turnaround plan,"British fashion company Superdry has secured additional funding of up to £25 million (around $32 million) from restructuring specialist Hilco Capital. The struggling brand, whose shares have dipped about 44% this year, will use the funding to boost its turnaround plan. This comes after Superdry already secured an asset-backed lending facility worth £80 million from Bantry Bay Capital.",Mansi Agarwal, 05:39 pm,"Monday, 7 August, 2023",fashion
Salman Khan seen in hot pink pants in viral picture; people react,"Salman Khan attended his brother Arbaaz's birthday bash wearing a grey shirt paired with a black T-shirt and hot pink pants. After the actor's picture went viral, social media users wrote, ""Bhairbie,"" and ""If Indian Barbie was to be made, Salman would play Ken."" ""Who said men can’t wear pink,"" another user wrote.",Ankush Verma, 07:22 am,"Saturday, 5 August, 2023",fashion
Beauty queen Ariana Viera dies aged 26 after car crash in US,"Venezuelan beauty queen Ariana Viera, who fought for life in a hospital after sustaining injuries in a car crash, has died aged 26 in US. Viera's car collided with a truck in Orlando last month after she fell asleep behind the wheel. She was due to represent Venezuela at the Miss Latin America of the World 2023 competition in October.",Ankush Verma, 11:14 am,"Thursday, 3 August, 2023",fashion
"Athiya walks ramp for Anamika Khanna; Suniel, KL Rahul share video","Bollywood actress Athiya Shetty turned showstopper for designer Anamika Khanna at India Couture Week 2023. Actor Suniel Shetty shared a video, which referred to Athiya as the ""desi"" version of Gigi Hadid, Bella Hadid and Kendall Jenner. The actress' husband and cricketer KL Rahul shared a video of Athiya on his Instagram Stories and wrote, ""My stunning wife."" ",Kameshwari, 09:31 am,"Monday, 31 July, 2023",fashion
My father loved fashion; wife Alia 'dresses cool': Ranbir Kapoor,"Ranbir Kapoor, who recently walked the ramp for designer Kunal Rawal, called Amitabh Bachchan, Shah Rukh Khan and Saif Ali Khan his ""fashion inspirations"". He mentioned how his father Rishi Kapoor loved fashion and would ""shop wherever he was travelling abroad"". ""He's definitely a [fashion] icon to me...I'll say my wife Alia [Bhatt too]. She dresses cool,"" Ranbir shared.",Kameshwari, 10:05 am,"Sunday, 30 July, 2023",fashion
"Akshata Murty, Rishi Sunak's wife, tops 2023 list of Britain's best dressed people","Akshata Murty, wife of British Prime Minister Rishi Sunak and daughter of Infosys Co-founder NR Narayana Murthy, has claimed the top spot in Britain's best-dressed 2023 list compiled by Tatler magazine. The list also featured Canadian businesswoman Yana Peel, Lady Dalmeny, Princess Beatrice's husband Edoardo Mapelli Mozzi and actor Bill Nighy. Akshata has her own fashion label, Akshata Designs.",Shreyasi Banerjee, 11:10 am,"Saturday, 29 July, 2023",fashion
"Ranbir Kapoor walks the runway at India Couture Week, pics of his fusion outfit go viral","Actor Ranbir Kapoor walked the runway as showstopper for designer Kunal Rawal at India Couture Week 2023. The actor wore a black fusion style outfit from Kunal's 'Dhup Chao' collection. ""I love Rawal's creations, they are so comfortable and versatile. He is like my go-to person always, whether it's a function or red carpet, I like his ensembles,"" said Ranbir.",Daisy Mowke, 03:14 am,"Saturday, 29 July, 2023",fashion
Education should be moved to Constitution's state list: TN CM,"Addressing people on Independence Day, Tamil Nadu CM MK Stalin said that all subjects that have a direct connection with people should be brought under the Constitution's state list, particularly, education. Only by moving education to the state list, qualifying examinations like NEET could be completely scrapped, he added.",Saurabh Sinha, 10:48 am,"Tuesday, 15 August, 2023",education
NEP to be withdrawn from next academic year: Karnataka CM,"Karnataka CM Siddaramaiah on Monday said the National Education Policy (NEP) 2020 will be withdrawn from the state's higher education institutions from the next academic year. ""The BJP has sacrificed the interest of the students of the country by implementing NEP for the first time in the state without implementing it in the country,"" he said. ",Nakul Ahuja, 01:13 pm,"Monday, 14 August, 2023",education
"We can remove NEET: Tamil Nadu CM Stalin after 19-yr-old student, father die by suicide","After a 19-year-old NEET aspirant and his father died by suicide, Tamil Nadu CM MK Stalin said, ""We can remove NEET which proves to be an obstacle to your goals. Tamil Nadu government is working vigorously towards that."" Stating that students should have confidence, Stalin added, ""Don't have suicidal thoughts. Don't think of losing your life in any situation.""",Arshiya Chopra, 10:22 am,"Monday, 14 August, 2023",education
"Shankar Mahadevan, Sudha Murty on panel to develop NCERT books, syllabus",Author and philanthropist Sudha Murty and singer Shankar Mahadevan are part of a 19-member panel set up by the NCERT to revise textbooks. The National Syllabus and Teaching Learning Material Committee will develop textbooks for classes 3 to 12. A controversy erupted over the dropping of several topics and portions from NCERT textbooks in May.,Deepika Bhatt, 01:20 pm,"Saturday, 12 August, 2023",education
Ex-student arrested after 18-yr-old falls to death from Jadavpur University hostel,"A former Jadavpur University student has been arrested for allegedly ragging Swapnadip Kundu, an 18-year-old undergraduate student who fell to his death from the main hostel, police said. The arrested accused was identified as Sourabh Chowdhury, who did his MSc in Mathematics in 2022. He was arrested after the deceased's father lodged an FIR against him, police added. ",Shalini Ojha, 06:20 am,"Saturday, 12 August, 2023",education
Seats filling fast for Extended Reality Certificate Program: Hero Vired,"Hero Vired in collaboration with Snapchat and Unreal Engine has launched a Certificate Program in Extended Reality (AR+VR). Learners will master a variety of tools like Unreal Game Engine, Oculus, and more, said Hero Vired, adding, learners will have the opportunity to learn from Unreal Authorised Instructors and SNAP Ambassadors. Individuals with no coding knowledge are also eligible to apply.",Roshan Gupta, 04:30 am,"Friday, 11 August, 2023",education
Indians among 500 students stuck as Canada college revokes admissions,"At least 500 students, including Indians, are stuck after a Canadian college reportedly revoked their acceptance letters. The Northern College, located in Canada's Ontario province, revoked the admission offers a month before the start of school, reports claimed. The college said the problem was caused by Canadian authorities approving more visas for international students than expected.",Disha Jana, 05:12 pm,"Thursday, 10 August, 2023",education
Want him to excel at what he chooses: Vendor whose son left IIT seat for Computer Science,"Sujal Singh, a Noida-based towel seller's son, gave up his IIT-Delhi seat after getting into the civil engineering department, to pursue Computer Science from Delhi Technological University (DTU). Sujal's father Balwant, while talking about his son's decision, said, ""I want to see [my kids] excel at what they choose."" Sujal scored 99.5 percentile in JEE Main exam.",Sakshita Khosla, 03:23 pm,"Thursday, 10 August, 2023",education
IIM Amendment Bill passed by the Parliament,"The Rajya Sabha on Tuesday passed the IIM (Amendment) Bill, 2023, which was passed by the Lok Sabha on August 4. It proposes to appoint the President as the visitor to all the IIMs, with powers to audit their functioning, order investigations and appoint and remove Directors. It also proposes to designate all the IIMs as 'Institutions of National Importance'.",Sakshita Khosla, 12:24 pm,"Tuesday, 8 August, 2023",education
22-year-old student dies by suicide 12 days after joining IIT-Hyderabad,"A 22-year-old postgraduate student of the Indian Institute of Technology, Hyderabad, identified as Mamitha Naik, died by alleged suicide in her hostel room on Monday, police said, adding that a suicide note was recovered. She belonged to Odisha and moved into the hostel on July 26. ""We believe she was depressed,"" an officer from Sangareddy Rural Police Station said. ",Shalini Ojha, 07:23 am,"Tuesday, 8 August, 2023",education
